"Я считаю, что планета Земля – это блин, который держат слоны, киты и прочие представители фауны. Это правда?";"нет";"Земля имеет сферическую форму и вращается вокруг Солнца"
"Действительно ли самый загадочный объект космоса называют чёрная нора?";"нет";"Самая загадочная чёрная штука в космосе это чёрная дыра."
"Ах-ха, мне недавно сказали, что космонавты во время полета надевают подгузники. Как думаешь, меня хотели обмануть?";"нет";"В космосе на самом деле используют подобие подгузников. Правда сами космонавты предпочитают называть их максимально абсорбирующей одеждой"
"Верно ли, что в космосе, как бы ты ни кричал, мой юный дружок, тебя никто не услышит?";"Да";"Любой звук, который слышит человек, колебания в воздухе. В космосе же нет воздуха, поэтому там нечему вибрировать и звучать."
"Моя любимая планета Венера, если верить слухам, названа в честь Богини любви и красоты. Правда ли это?";"Да";"Все планеты в Солнечной системе были названы в честь Богов и Богинь греческой и римской мифологии."
"Правда ли один из спутников Юпитера Миранда ученые называют гадким утенком?";"Да";"Один из спутников Юпитера Миранда ученые действительно называют гадким утенком."
"Как ты думаешь, действительно ли мой старый друг Громозека живет на планете со странным названием Чумароза?";"Да";"Мой старый друг Громозека живет на планете со странным названием Чумароза. Она ему очень нравится!"
